    ^B^@^D^@^@^@^@^@^@^@^@^@^@^@^D^@^A^@^@^@
17:18:15.835551 IP 172.17.0.2.54022 > 48344d073c91.http-alt: Flags [S], seq 1291722765, win 64240, options [mss 1460,sackOK,TS val 2828194938 ecr 0,nop,wsc>17:18:15.835562 IP 48344d073c91.http-alt > 172.17.0.2.54022: Flags [S.], seq 3288969397, ack 1291722766, win 65160, options [mss 1460,sackOK,TS val 6758607>17:18:15.835576 IP 172.17.0.2.54022 > 48344d073c91.http-alt: Flags [.], ack 1, win 502, options [nop,nop,TS val 2828194938 ecr 675860770], length 0
17:18:15.835727 IP 172.17.0.2.54022 > 48344d073c91.http-alt: Flags [P.], seq 1:5, ack 1, win 502, options [nop,nop,TS val 2828194939 ecr 675860770], length>17:18:15.835730 IP 48344d073c91.http-alt > 172.17.0.2.54022: Flags [.], ack 5, win 510, options [nop,nop,TS val 675860771 ecr 2828194939], length 0
17:18:15.835952 IP 48344d073c91.http-alt > 172.17.0.2.54022: Flags [P.], seq 1:5, ack 5, win 510, options [nop,nop,TS val 675860771 ecr 2828194939], length>17:18:15.836045 IP 172.17.0.2.54022 > 48344d073c91.http-alt: Flags [.], ack 5, win 502, options [nop,nop,TS val 2828194939 ecr 675860771], length 0
17:18:15.836573 IP 172.17.0.2.54022 > 48344d073c91.http-alt: Flags [F.], seq 5, ack 5, win 502, options [nop,nop,TS val 2828194939 ecr 675860771], length 0
17:18:15.836910 IP 48344d073c91.http-alt > 172.17.0.2.54022: Flags [F.], seq 5, ack 6, win 510, options [nop,nop,TS val 675860772 ecr 2828194939], length 0
17:18:15.836986 IP 172.17.0.2.54022 > 48344d073c91.http-alt: Flags [.], ack 6, win 502, options [nop,nop,TS val 2828194940 ecr 675860772], length 0
17:18:15.947652 IP 48344d073c91.37044 > 192.168.65.7.domain: 18545+ PTR? 2.0.17.172.in-addr.arpa. (41)
17:18:15.984633 IP 192.168.65.7.domain > 48344d073c91.37044: 18545 NXDomain 0/0/0 (41)
17:18:16.056692 IP 48344d073c91.37121 > 192.168.65.7.domain: 54672+ PTR? 7.65.168.192.in-addr.arpa. (43)
17:18:16.092545 IP 192.168.65.7.domain > 48344d073c91.37121: 54672 NXDomain 0/0/0 (43)
17:18:20.846626 ARP, Request who-has 172.17.0.2 tell 48344d073c91, length 28
17:18:20.846658 ARP, Request who-has 48344d073c91 tell 172.17.0.2, length 28
17:18:20.846660 ARP, Reply 48344d073c91 is-at 02:42:ac:11:00:03 (oui Unknown), length 28
17:18:20.846661 ARP, Reply 172.17.0.2 is-at 02:42:ac:11:00:02 (oui Unknown), length 28
17:18:21.006709 ARP, Request who-has 172.17.0.1 tell 48344d073c91, length 28
17:18:21.006727 ARP, Request who-has 48344d073c91 tell 172.17.0.1, length 28
17:18:21.006741 ARP, Reply 48344d073c91 is-at 02:42:ac:11:00:03 (oui Unknown), length 28
17:18:21.006794 ARP, Reply 172.17.0.1 is-at 02:42:6a:6e:55:85 (oui Unknown), length 28
17:18:21.007059 IP 48344d073c91.55752 > 192.168.65.7.domain: 56121+ PTR? 1.0.17.172.in-addr.arpa. (41)
17:18:21.047309 IP 192.168.65.7.domain > 48344d073c91.55752: 56121 NXDomain 0/0/0 (41)
